{
  "contract_id": "SU8-CONTRACT-SYNTHETIC-SMOKE",
  "version": "v8.0-dev2",
  "measurement_components": [
    "relative_geometry",
    "session_state",
    "free_selection_q",
    "fixed_response_B"
  ],
  "observation_bundle": {
    "operator_registry_id": "SU8-SYNTHETIC-OPS-v1",
    "occasion_definition": "synthetic bounded dialogue session",
    "context_fields": ["condition_id", "turn_index", "speaker_role"],
    "support_rule": "synthetic minimum two repeated sessions per condition"
  },
  "representation_bundle": {
    "representation_id": "SU8-SYNTHETIC-REP-v1",
    "runtime_revision": "synthetic-runtime-v1",
    "frozen_before_confirmation": true
  },
  "semantic_transducer": {
    "enabled": true,
    "role": "observation_semantic_transducer",
    "provider": "synthetic_fixture",
    "model_id": "deterministic-semantic-fixture",
    "model_revision": "synthetic-model-v1",
    "prompt_path": "prompts/v8_semantic_observer_v1.txt",
    "prompt_sha256": "f9c0e72d393bf46ef2cb103c41702da47a2d49af9eea05dc690c3c16d775b19b",
    "output_schema_id": "suica.v8.semantic_observation.v1",
    "output_schema_path": "schemas/v8_semantic_observation.schema.json",
    "schema_sha256": "74a43146e418365503c8b807e7af920a3151d7569c3f811dd91f3c0dda43b732",
    "output_fields": [
      "observation_id",
      "segment_id",
      "event_type",
      "source_span_ids",
      "polarity",
      "intensity",
      "confidence",
      "abstain"
    ],
    "decoding": {"temperature": 0.0, "top_p": 1.0},
    "repetitions": 3
  },
  "measurement_bundle": {
    "aggregation_runtime": "deterministic_code",
    "aggregator_entrypoint": "suica_core.v8_aggregation:aggregate_semantic_observations",
    "aggregator_path": "suica_core/v8_aggregation.py",
    "aggregator_sha256": "9531504867ecbc9d18317675f8c26467ec7ef86586b3e8a68651e91fd2a55c15",
    "allowed_input_fields": [
      "observation_id",
      "segment_id",
      "event_type",
      "source_span_ids",
      "polarity",
      "intensity",
      "confidence",
      "abstain"
    ],
    "reference_population": "synthetic-reference-v1",
    "support_refusal_active": true
  },
  "role_separation": {
    "builder": {
      "agent_id": "synthetic-builder",
      "session_id": "synthetic-builder-session",
      "model_revision": "synthetic-model-builder",
      "runtime_sha256": "1111111111111111111111111111111111111111111111111111111111111111",
      "implementation_sha256": "2222222222222222222222222222222222222222222222222222222222222222"
    },
    "auditor": {
      "agent_id": "synthetic-independent-auditor",
      "session_id": "synthetic-audit-session",
      "model_revision": "synthetic-model-auditor",
      "runtime_sha256": "3333333333333333333333333333333333333333333333333333333333333333",
      "implementation_sha256": "4444444444444444444444444444444444444444444444444444444444444444"
    },
    "semantic_transducer": {
      "agent_id": "synthetic-observer",
      "session_id": "synthetic-observer-session",
      "model_revision": "synthetic-model-observer",
      "runtime_sha256": "5555555555555555555555555555555555555555555555555555555555555555",
      "implementation_sha256": "6666666666666666666666666666666666666666666666666666666666666666"
    },
    "interpreter": {
      "agent_id": "synthetic-interpreter",
      "session_id": "synthetic-interpreter-session",
      "model_revision": "synthetic-model-interpreter",
      "runtime_sha256": "7777777777777777777777777777777777777777777777777777777777777777",
      "implementation_sha256": "8888888888888888888888888888888888888888888888888888888888888888"
    },
    "adaptation_agent": {
      "agent_id": "synthetic-adapter",
      "session_id": "synthetic-adapter-session",
      "model_revision": "synthetic-model-adapter",
      "runtime_sha256": "9999999999999999999999999999999999999999999999999999999999999999",
      "implementation_sha256": "aaaaaaaaaaaaaaaaaaaaaaaaaaaaaaaaaaaaaaaaaaaaaaaaaaaaaaaaaaaaaaaa"
    },
    "human_authority": {"authority_id": "suica-v8-synthetic-authority"},
    "auditor_attestation": {
      "path": "configs/v8_bundles/auditor_attestation_smoke.json",
      "sha256": "b1b3b56a0153c6520e58f6594752d3de63adc5e7db8a561bcd0ac321bab9a11b"
    }
  },
  "data_requirements": {
    "opportunity_menu_logging": true,
    "selection_flag": true,
    "randomized_repeated_conditions": true,
    "minimum_sessions_per_person_condition": 2,
    "state_occasion_defined": true
  },
  "explanation_policy": {
    "evidence_graph_required": true,
    "positive_and_counterevidence_required": true,
    "necessity_test_required": true,
    "sufficiency_test_required": true,
    "sentence_binding_required": true,
    "interpreter_input": "evidence_graph_only",
    "renderer": "controlled_templates_v1"
  },
  "uncertainty_policy": {
    "components": [
      "source_cluster",
      "representation",
      "llm_run",
      "prompt",
      "reference_norm",
      "model"
    ],
    "combination_method": "joint_nested",
    "refuse_without_joint_draws": true
  },
  "adaptation_policy": {
    "active_bundle_immutable": true,
    "candidate_status_only": true,
    "confirmation_hidden": true,
    "independent_audit_required": true,
    "human_authorization_required": true,
    "promotion_status": "CANDIDATE_ONLY",
    "active_bundle": {
      "path": "configs/v8_bundles/active_smoke.json",
      "sha256": "22f71780a9eb4da8ac8d50a9fb2ba84a689d692e23b1de1064203d9634f398ba"
    },
    "candidate_bundle": {
      "path": "configs/v8_bundles/candidate_smoke.json",
      "sha256": "8033dddfd2fc25b30f3f517f1644c86aa9c627db345fc84c3f0ddff79ff6be31"
    },
    "candidate_parent_sha256": "22f71780a9eb4da8ac8d50a9fb2ba84a689d692e23b1de1064203d9634f398ba",
    "active_sha256_before": "22f71780a9eb4da8ac8d50a9fb2ba84a689d692e23b1de1064203d9634f398ba",
    "active_sha256_after": "22f71780a9eb4da8ac8d50a9fb2ba84a689d692e23b1de1064203d9634f398ba",
    "promotion_ledger": {
      "path": "configs/v8_bundles/promotion_ledger_smoke.json",
      "sha256": "ec1e9febd807278d052403333e5dc6121f169f7eca305d894bb59ee758d8964e"
    }
  },
  "claim_boundary": "Synthetic contract smoke only; no human or psychological evidence."
}
